{
  "$schema": "../schema/crd.schema.json",
  "name": "Generate a recurring report",
  "definition": "Enable a requester to receive a report, produced on a schedule or on demand, that reflects current data against stated parameters -- without requiring a suitable report-generation implementation to already exist before the first request.",
  "capabilityPurpose": "Enable a defined report to be produced repeatedly from current data, without the requester having to build or maintain the generation logic themselves.",
  "boundaries": {
    "includes": [
      "Specifying the report's parameters and cadence",
      "Producing one report instance per request or scheduled occurrence",
      "When no suitable generation implementation yet exists, constructing and validating one as part of fulfilling that occurrence"
    ],
    "excludes": [
      "Authoring or approving the report's underlying business definition/template",
      "Distributing the produced report to its recipients",
      "Modifying the underlying source data being reported on"
    ]
  },
  "meaningfulOutcome": "A report instance is produced that reflects the current data against the stated parameters, or the attempt is rejected or deferred with an identifiable reason.",
  "interactionContracts": [
    {
      "name": "Request a recurring report",
      "actor": "Requester",
      "commandIntent": "Define report parameters and a production cadence (on demand, or on a schedule)",
      "currentState": "No report definition exists for this request",
      "policiesInvariants": [
        {
          "text": "Parameters must be sufficient to determine what data the report draws on and how it is scoped.",
          "semanticClass": "rule-invariant",
          "evidenceStatus": "reasonable-inference",
          "source": "Illustrative example"
        }
      ],
      "transition": "No report definition to a standing report definition",
      "result": "Report definition acknowledged and scheduled (or ready for on-demand production)",
      "eventsEffects": ["RecurringReportDefined"],
      "unknowns": ["Exact scheduling/trigger mechanism"]
    },
    {
      "name": "Produce report",
      "actor": "The capability's own realization (agent, agent-built software, or software)",
      "commandIntent": "Produce one report instance matching the current definition against current data",
      "currentState": "A standing report definition exists; this occurrence is due (by schedule or on-demand request)",
      "policiesInvariants": [
        {
          "text": "A produced report instance must reflect the actual current data available at generation time -- it must not silently substitute stale or cached data without disclosing that it did.",
          "semanticClass": "rule-invariant",
          "evidenceStatus": "reasonable-inference",
          "source": "Illustrative example"
        }
      ],
      "transition": "Due occurrence to produced report instance, or an identifiable failure",
      "result": "A report instance, or an identifiable failure reason (e.g. data unavailable, parameters no longer resolvable)",
      "eventsEffects": ["ReportProduced", "ReportGenerationFailed"],
      "unknowns": ["Where a constructed implementation is stored, versioned, and audited", "Policy for retiring an implementation once report parameters change materially"]
    }
  ],
  "rulesInvariants": [
    {
      "text": "An agent-built implementation must be validated against the current report parameters before it is reused, unattended, for a subsequent occurrence.",
      "semanticClass": "implementation-requirement",
      "evidenceStatus": "reasonable-inference",
      "source": "Illustrative example"
    }
  ],
  "recommendedDefaults": [
    {
      "text": "If a previously agent-built implementation fails validation against new parameters or a changed data shape, fall back to agent-primary construction again for that occurrence rather than silently reusing an implementation that no longer fits.",
      "semanticClass": "recommended-default",
      "evidenceStatus": "reasonable-inference",
      "source": "Illustrative example"
    }
  ],
  "unknowns": [
    "Exact scheduling/trigger mechanism",
    "Where a constructed implementation is stored, versioned, and audited",
    "Policy for retiring an implementation once report parameters change materially",
    "How a partial or degraded data source is disclosed within a produced report"
  ],
  "terms": ["requester", "report parameters", "report instance", "generation implementation"],
  "realizations": [
    {
      "name": "Agent constructs, then produces, the first occurrence",
      "kind": "agent",
      "executionMode": "agent-primary-using-software",
      "rationaleIntent": "The first time this report definition is due, no suitable generation implementation exists yet. An agent interprets the parameters, determines that no reusable implementation is available, builds a function or script that produces the report from the current data, and validates it before producing this occurrence's report instance with it.",
      "implementationRequirements": [
        {
          "text": "The newly built implementation must pass validation against the current parameters (and a known-correct sample, if one is available) before it is treated as reusable for future occurrences.",
          "semanticClass": "implementation-requirement",
          "evidenceStatus": "reasonable-inference",
          "source": "Illustrative example"
        }
      ],
      "exposure": ["tool"]
    },
    {
      "name": "Agent-built implementation produces subsequent occurrences",
      "kind": "agent-built-software",
      "executionMode": "software-primary",
      "rationaleIntent": "Once Realization A's implementation has been validated, every subsequent due occurrence of Produce report runs that implementation directly and deterministically -- the same Interaction Contract MLE and required outcome, now served by construction provenance (agent-built-software) paired with an ordinary, agent-uninvolved execution mode (software-primary).",
      "exposure": ["workflow", "internal"]
    }
  ],
  "agenticMappings": [
    {
      "id": "report-construction-assistant",
      "kind": "skill",
      "relationship": "realizes-capability",
      "capabilityRefs": ["generate-a-recurring-report"],
      "notes": "Realization A only -- invoked when no valid implementation currently exists for this report definition."
    },
    {
      "id": "parameter-resolution-tool",
      "kind": "tool",
      "relationship": "supports-contract",
      "notes": "Supports Request a recurring report and validation in Produce report."
    },
    {
      "id": "data-access-tool",
      "kind": "tool",
      "relationship": "supports-contract",
      "notes": "Supports Produce report in both realizations."
    },
    {
      "id": "agent-built-report-generation-implementation",
      "kind": "tool",
      "relationship": "realizes-capability",
      "capabilityRefs": ["generate-a-recurring-report"],
      "notes": "Realization B -- the artifact Realization A constructed and validated; not a skill, since no agent reasoning occurs when it runs."
    }
  ],
  "provenance": [
    {
      "text": "This is an illustrative example, not extracted from a real reporting system. It exists to make explicit that agent-built-software is implementation provenance, while execution mode is a separate, runtime-control question (specification section 3.3).",
      "semanticClass": "example",
      "evidenceStatus": "explicit-fact",
      "source": "examples/generate-a-recurring-report.json"
    }
  ]
}
